Sheet: Main
B1: Format | C1: %Y-%m-%d
B2: Start | C2: 2015-01-01
B3: End | C3: 2022-01-01
B4: Accounts | C4: A | D4: B | E4: C | F4: D | G4: E | H4: a | I4: b | J4: c | K4: d | L4: e | M4: 30 as 30 | N4: 30 as 15 | O4: 15 as 15
B5: Plot | C5: A | D5: 1
B6: Plot | C6: B | D6: 1
B7: Plot | C7: C | D7: 1
B8: Plot | C8: 30 as 30 | D8: 3
B9: Plot | C9: 30 as 15 | D9: 3
B10: Plot | C10: 15 as 15 | D10: 3
A11: # | F11: Accounts | H11: Dates | J11: Periods
A12: # | B12: Name | C12: Scenarios | D12: Type | E12: Amount | F12: Credit | G12: Debit | H12: Start | I12: End | J12: Years | K12: Months | L12: Weeks | M12: Days | N12: Interest Rate
B13: A | D13: Account | H13: of:=EDATE([.H19];1) -> 2015-02-01 | I13: of:=[.$C$3] -> 2022-01-01 | K13: 1 | N13: of:=[.O13]/12 -> 0.28125 | O13: 3.375 | P13: 0.0025 | Q13: of:=[.P13]*[.E19] -> 370
B14: B | D14: Account | H14: of:=EDATE([.H20];1) -> 2015-02-01 | I14: of:=[.$C$3] -> 2022-01-01 | K14: 1 | N14: of:=[.O14]/12 -> 0.291666666666667 | O14: 3.5 | P14: -0.00375 | Q14: of:=[.P14]*[.E20] -> -555
B15: C | D15: Account | H15: of:=EDATE([.H21];1) -> 2015-02-01 | I15: of:=[.$C$3] -> 2022-01-01 | K15: 1 | N15: of:=[.O15]/12 -> 0.302083333333333 | O15: 3.625 | P15: -0.01 | Q15: of:=[.P15]*[.E21] -> -1480
B16: D | D16: Account | H16: of:=EDATE([.H22];1) -> 2015-02-01 | I16: of:=[.$C$3] -> 2022-01-01 | K16: 1 | N16: of:=[.O16]/12 -> 0.354166666666667 | O16: 4.25 | P16: -0.00875 | Q16: of:=[.P16]*[.E22] -> -1295
B17: E | D17: Account | H17: of:=EDATE([.H23];1) -> 2015-02-01 | I17: of:=[.$C$3] -> 2022-01-01 | K17: 1 | N17: of:=[.O17]/12 -> 0.364583333333333 | O17: 4.375 | P17: -0.015 | Q17: of:=[.P17]*[.E23] -> -2220
B19: Loan | D19: Single | E19: 148000 | G19: A | H19: of:=[.$C$2] -> 2015-01-01
B20: Loan | D20: Single | E20: 148000 | G20: B | H20: of:=[.$C$2] -> 2015-01-01
B21: Loan | D21: Single | E21: 148000 | G21: C | H21: of:=[.$C$2] -> 2015-01-01
B22: Loan | D22: Single | E22: 148000 | G22: D | H22: of:=[.$C$2] -> 2015-01-01
B23: Loan | D23: Single | E23: 148000 | G23: E | H23: of:=[.$C$2] -> 2015-01-01
A24: # | B24: All-in | C24: of:=[.E19]+MAX([.Q13:.Q17]) -> 148370
B25: Points | D25: Single | E25: of:=MAX([.$Q$13:.$Q$17])-[.Q13] -> 0 | F25: A | H25: of:=[.$C$2] -> 2015-01-01
B26: Points | D26: Single | E26: of:=MAX([.$Q$13:.$Q$17])-[.Q14] -> 925 | F26: B | H26: of:=[.$C$2] -> 2015-01-01
B27: Points | D27: Single | E27: of:=MAX([.$Q$13:.$Q$17])-[.Q15] -> 1850 | F27: C | H27: of:=[.$C$2] -> 2015-01-01
B28: Points | D28: Single | E28: of:=MAX([.$Q$13:.$Q$17])-[.Q16] -> 1665 | F28: D | H28: of:=[.$C$2] -> 2015-01-01
B29: Points | D29: Single | E29: of:=MAX([.$Q$13:.$Q$17])-[.Q17] -> 2590 | F29: E | H29: of:=[.$C$2] -> 2015-01-01
B32: Payment | C32: 695.95 | D32: Annuity | E32: 750 | F32: A | G32: a | H32: of:=EDATE([.H19];1) -> 2015-02-01 | I32: of:=[.$C$3] -> 2022-01-01 | K32: 1 | O32: of:=IF(EXACT([.F32];"General");1;IF(EXACT([.F32];"General");-1;"")) -> 
B33: Payment | C33: 706.57 | D33: Annuity | E33: 750 | F33: B | G33: b | H33: of:=EDATE([.H20];1) -> 2015-02-01 | I33: of:=[.$C$3] -> 2022-01-01 | K33: 1
B34: Payment | C34: 717.28 | D34: Annuity | E34: 750 | F34: C | G34: c | H34: of:=EDATE([.H21];1) -> 2015-02-01 | I34: of:=[.$C$3] -> 2022-01-01 | K34: 1
B35: Payment | C35: 728.07 | D35: Annuity | E35: 750 | F35: D | G35: d | H35: of:=EDATE([.H22];1) -> 2015-02-01 | I35: of:=[.$C$3] -> 2022-01-01 | K35: 1
B36: Payment | C36: 738.94 | D36: Annuity | E36: 750 | F36: E | G36: e | H36: of:=EDATE([.H23];1) -> 2015-02-01 | I36: of:=[.$C$3] -> 2022-01-01 | K36: 1
A38: # | B38: Purchase | C38: Down
A39: # | B39: 185000 | C39: 0.2 | D39: of:=[.B39]*[.C39] -> 37000
B42: 30 as 30 | D42: Account | H42: of:=[.$C$2] -> 2015-01-01 | I42: of:=[.$C$3] -> 2022-01-01 | K42: 1 | N42: of:=[.O42]/12 -> 0.375 | O42: 4.5 | P42: -0.01625 | Q42: of:=[.P42]*[.E43] -> -2405
B43: Loan | D43: Single | E43: 148000 | G43: 30 as 30 | H43: of:=[.H42] -> 2015-01-01
B44: Credit | D44: Single | E44: of:=[.Q53]-[.Q42] -> 925 | F44: 30 as 30 | H44: of:=[.H43] -> 2015-01-01
B45: Payment | C45: 50.23 | D45: Annuity | E45: of:=[.C45]*[.E43]/10000 -> 743.404 | F45: 30 as 30 | H45: of:=EDATE([.H43];1) -> 2015-02-01 | I45: of:=[.$C$3] -> 2022-01-01 | K45: 1
B46: Equalizer | D46: Single | E46: of:=([.E51]-[.E45])*ORG.OPENOFFICE.MONTHS([.H43];[.I45]; ) -> 26965.008 | F46: 30 as 30 | H46: of:=EDATE([.I45];-1) -> 2021-12-01 | I46: of:=[.I45] -> 2022-01-01
B48: 30 as 15 | D48: Account | H48: of:=[.H42] -> 2015-01-01 | I48: of:=[.I42] -> 2022-01-01 | K48: of:=[.K42] -> 1 | N48: of:=[.N42] -> 0.375 | O48: of:=[.O42] -> 4.5 | P48: of:=[.P42] -> -0.01625 | Q48: of:=[.P48]*[.E49] -> -2405
B49: Loan | D49: Single | E49: 148000 | G49: 30 as 15 | H49: of:=[.H48] -> 2015-01-01
B50: Credit | D50: Single | E50: of:=[.E44] -> 925 | F50: 30 as 15 | H50: of:=[.H49] -> 2015-01-01
B51: of:=[.B45] -> Payment | C51: of:=[.C45] -> 50.23 | D51: of:=[.D45] -> Annuity | E51: of:=[.E56] -> 1064.416 | F51: 30 as 15 | H51: of:=[.H45] -> 2015-02-01 | I51: of:=[.I45] -> 2022-01-01 | K51: of:=[.K45] -> 1
B53: 15 as 15 | D53: Account | H53: of:=[.$C$2] -> 2015-01-01 | I53: of:=[.$C$3] -> 2022-01-01 | K53: 1 | N53: of:=[.O53]/12 -> 0.302083333333333 | O53: 3.625 | P53: -0.01 | Q53: of:=[.P53]*[.E54] -> -1480
B54: Loan | D54: Single | E54: 148000 | G54: 15 as 15 | H54: of:=[.H53] -> 2015-01-01
A55: d | B55: Credit | D55: Single | E55: of:=-[.Q53] -> 1480 | F55: 15 as 15 | H55: of:=[.H54] -> 2015-01-01
B56: of:=[.B51] -> Payment | C56: 71.92 | D56: of:=[.D51] -> Annuity | E56: of:=[.C56]*[.E54]/10000 -> 1064.416 | F56: 15 as 15 | H56: of:=[.H51] -> 2015-02-01 | I56: of:=[.I51] -> 2022-01-01 | K56: of:=[.K51] -> 1
A59: # | C59: 99600 | G59: 101700
A60: # | C60: 95400 | G60: 97300
A61: # | C61: 88200 | D61: of:=[.C60]-[.C61] -> 7200 | E61: of:=[.C59]-[.C61] -> 11400 | G61: 90100 | H61: of:=[.G60]-[.G61] -> 7200 | I61: of:=[.G59]-[.G61] -> 11600